{
  "$schema": "http://json-schema.org/draft-07/schema#",
  "description": "A representation of an event",
  "type": "object",
  "additionalProperties": false,
  "properties": {
    "CorrelationId": {
      "type": "string",
      "description": "Correlation ID used for logging and as debug information"
    },
    "DataSetClassId": {
      "type": "string",
      "description": "Dataset Class ID"
    },
    "MessageId": {
      "type": "string",
      "description": "Message ID"
    },
    "Messages": {
      "type": "array",
      "description": "Messages Array",
      "items": {
        "$ref": "DataSetMessage.schema.json"
      }
    },
    "MessageType": {
      "type": "string",
      "enum": [
        "ua-data"
      ],
      "description": "Message Type"
    },
    "PublisherId": {
      "type": "string",
      "description": "Publisher ID"
    }
  },
  "required": [
    "MessageId",
    "MessageType",
    "PublisherId",
    "DataSetClassId",
    "Messages"
  ]
}