{
    "MessageId": "not yet defined",
    "MessageType": "ua-data",
    "PublisherId": "Registry/hilscher.com/container/99/FFEF3342",
    "DataSetClassId": "da508b5b-5ebc-439a-818f-d723a79afafc",
    "Messages": [
        {
            "DataSetWriterId": "BaseOI4Container",
            "SequenceNumber": 2,
            "MetaDataVersion": {
                "majorVersion": 601689600,
                "minorVersion": 614822400
            },
            "Timestamp": "2019-06-26T13:16:00+01:00",
            "Status": 2147942400,
            "Payload": {
                "Temperature": 37,
                "Humidity": 50
            }
        }
    ]
}